{
  "schemaVersion": "1.0.0",
  "fixtureId": "browser.snapshot.success",
  "description": "A Host-injected frozen browser snapshot becomes one bound Evidence record.",
  "capability": "browser_snapshot",
  "scope": {
    "url": "https://example.test/orders"
  },
  "sourceIdentity": "https://example.test/orders",
  "stateDigest": "aaaaaaaaaaaaaaaaaaaaaaaaaaaaaaaaaaaaaaaaaaaaaaaaaaaaaaaaaaaaaaaa",
  "expected": {
    "status": "succeeded",
    "evidenceKinds": [
      "browser_snapshot"
    ],
    "evidenceCount": 1
  }
}
